"ds_num","title","resp","comp","status","consultations_requested_date","consultations_requested_month","consultations_requested_year","date_added"
DS437,Countervailing Duty Measures on Certain Products from China,United States,China,Authorization to retaliate requested (including 22.6 arbitration),"25",May,"2012","6 July 2020"
DS436,Countervailing Measures on Certain Hot-Rolled Carbon Steel Flat Products from India,United States,India,Compliance proceedings ongoing,"12",April,"2012","6 July 2020"
DS435,"Certain Measures Concerning Trademarks, Geographical Indications and Other Plain Packaging Requirements Applicable to Tobacco Products and Packaging",Australia,Honduras,"Report(s) adopted, no further action required","4",April,"2012","6 July 2020"
DS434,Certain Measures Concerning Trademarks and Other Plain Packaging Requirements Applicable to Tobacco Products and Packaging,Australia,Ukraine,Authority for panel lapsed,"13",March,"2012","6 July 2020"
DS433,"Measures Related to the Exportation of Rare Earths, Tungsten and Molybdenum",China,Japan,Implementation notified by respondent,"13",March,"2012","6 July 2020"
DS432,"Measures Related to the Exportation of Rare Earths, Tungsten and Molybdenum",China,European Union,Implementation notified by respondent,"13",March,"2012","6 July 2020"
DS431,"Measures Related to the Exportation of Rare Earths, Tungsten and Molybdenum",China,United States,Implementation notified by respondent,"13",March,"2012","6 July 2020"
DS430,Measures Concerning the Importation of Certain Agricultural Products,India,United States,"Authorization to retaliate requested (including 22.6 arbitration), Compliance proceedings ongoing","6",March,"2012","6 July 2020"
DS429,Anti-Dumping Measures on Certain Shrimp from Viet Nam,United States,Viet Nam,"Settled or terminated (withdrawn, mutually agreed solution)","20",February,"2012","6 July 2020"
DS428,Safeguard measures on imports of cotton yarn (other than sewing thread),Turkey,India,In consultations,"13",February,"2012","6 July 2020"
DS427,Anti-Dumping and Countervailing Duty Measures on Broiler Products from the United States,China,United States,Compliance proceedings completed with finding(s) of non-compliance,"20",September,"2011","6 July 2020"
DS426,Measures Relating to the Feed-in Tariff Program,Canada,European Union,Implementation notified by respondent,"11",August,"2011","6 July 2020"
DS425,Definitive Anti-Dumping Duties on X-Ray Security Inspection Equipment from the European Union,China,European Union,Implementation notified by respondent,"25",July,"2011","6 July 2020"
DS424,Anti-Dumping Measures on Imports of Stainless Steel Sheet and Strip in Coils from Italy,United States,European Union,In consultations,"1",April,"2011","6 July 2020"
DS423,Taxes on Distilled spirits,Ukraine,"Moldova, Republic of","Panel established, but not yet composed","3",March,"2011","6 July 2020"
DS422,Anti-Dumping Measures on Shrimp and Diamond Sawblades from China,United States,China,Implementation notified by respondent,"28",February,"2011","6 July 2020"
DS421,Measures Affecting the Importation and Internal Sale of Goods (Environmental Charge),"Moldova, Republic of",Ukraine,"Panel established, but not yet composed","17",February,"2011","6 July 2020"
DS420,Anti-dumping measures on corrosion-resistant carbon steel flat products from Korea,United States,"Korea, Republic of","Panel established, but not yet composed","31",January,"2011","6 July 2020"
DS419,Measures concerning wind power equipment,China,United States,In consultations,"22",December,"2010","6 July 2020"
DS418,Safeguard Measures on Imports of Polypropylene Bags and Tubular Fabric,Dominican Republic,El Salvador,Implementation notified by respondent,"19",October,"2010","6 July 2020"
DS417,Safeguard Measures on Imports of Polypropylene Bags and Tubular Fabric,Dominican Republic,Honduras,Implementation notified by respondent,"18",October,"2010","6 July 2020"
DS416,Safeguard Measures on Imports of Polypropylene Bags and Tubular Fabric,Dominican Republic,Guatemala,Implementation notified by respondent,"15",October,"2010","6 July 2020"
DS415,Safeguard Measures on Imports of Polypropylene Bags and Tubular Fabric,Dominican Republic,Costa Rica,Implementation notified by respondent,"15",October,"2010","6 July 2020"
DS414,Countervailing and Anti-Dumping Duties on Grain Oriented Flat-rolled Electrical Steel from the United States,China,United States,"Report(s) adopted, with recommendation to bring measure(s) into conformity","15",September,"2010","6 July 2020"
DS413,Certain Measures Affecting Electronic Payment Services,China,United States,Implementation notified by respondent,"15",September,"2010","6 July 2020"
DS412,Certain Measures Affecting the Renewable Energy Generation Sector,Canada,Japan,Implementation notified by respondent,"13",September,"2010","6 July 2020"
DS411,Measures Affecting the Importation and Internal Sale of Cigarettes and Alcoholic Beverages,Armenia,Ukraine,In consultations,"20",July,"2010","6 July 2020"
DS410,Anti-Dumping Duties on Fasteners and Chains from Peru,Argentina,Peru,In consultations,"19",May,"2010","6 July 2020"
DS409,Seizure of Generic Drugs in Transit,European Union and a Member State,Brazil,In consultations,"12",May,"2010","6 July 2020"
DS408,Seizure of Generic Drugs in Transit,European Union and a Member State,India,In consultations,"11",May,"2010","6 July 2020"
DS407,Provisional Anti-Dumping Duties on Certain Iron and Steel Fasteners from the European Union,China,European Union,In consultations,"7",May,"2010","6 July 2020"
DS406,Measures Affecting the Production and Sale of Clove Cigarettes,United States,Indonesia,Mutually acceptable solution on implementation notified,"7",April,"2010","6 July 2020"
DS405,Anti-Dumping Measures on Certain Footwear from China,European Union,China,Implementation notified by respondent,"4",February,"2010","6 July 2020"
DS404,Anti-dumping Measures on Certain Shrimp from Viet Nam,United States,Viet Nam,"Settled or terminated (withdrawn, mutually agreed solution)","1",February,"2010","6 July 2020"
DS403,Taxes on Distilled Spirits,Philippines,United States,Implementation notified by respondent,"14",January,"2010","6 July 2020"
DS402,Use of Zeroing in Anti-Dumping Measures Involving Products from Korea,United States,"Korea, Republic of",Implementation notified by respondent,"24",November,"2009","6 July 2020"
DS401,Measures Prohibiting the Importation and Marketing of Seal Products,European Communities,Norway,"Report(s) adopted, with recommendation to bring measure(s) into conformity","5",November,"2009","6 July 2020"
DS400,Measures Prohibiting the Importation and Marketing of Seal Products,European Communities,Canada,"Report(s) adopted, with recommendation to bring measure(s) into conformity","2",November,"2009","6 July 2020"
DS399,Measures Affecting Imports of Certain Passenger Vehicle and Light Truck Tyres from China,United States,China,"Report(s) adopted, no further action required","14",September,"2009","6 July 2020"
DS398,Measures Related to the Exportation of Various Raw Materials,China,Mexico,Implementation notified by respondent,"21",August,"2009","6 July 2020"
DS397,Definitive Anti-Dumping Measures on Certain Iron or Steel Fasteners from China,European Communities,China,"Report(s) adopted, with recommendation to bring measure(s) into conformity","31",July,"2009","6 July 2020"
DS396,Taxes on Distilled Spirits,Philippines,European Communities,Implementation notified by respondent,"29",July,"2009","6 July 2020"
DS395,Measures Related to the Exportation of Various Raw Materials,China,European Communities,Implementation notified by respondent,"23",June,"2009","6 July 2020"
DS394,Measures Related to the Exportation of Various Raw Materials,China,United States,Implementation notified by respondent,"23",June,"2009","6 July 2020"
DS393,Anti-Dumping Measures on Imports of Wheat Flour from Argentina,Chile,Argentina,In consultations,"14",May,"2009","6 July 2020"
DS392,Certain Measures Affecting Imports of Poultry from China,United States,China,"Report(s) adopted, no further action required","17",April,"2009","6 July 2020"
DS391,Measures Affecting the Importation of Bovine Meat and Meat Products from Canada,"Korea, Republic of",Canada,"Settled or terminated (withdrawn, mutually agreed solution)","9",April,"2009","6 July 2020"
DS390,"Grants, Loans and Other Incentives",China,Guatemala,In consultations,"19",January,"2009","6 July 2020"
DS389,Certain Measures Affecting Poultry Meat and Poultry Meat Products from the United States,European Communities,United States,"Panel established, but not yet composed","16",January,"2009","6 July 2020"
DS388,"Grants, Loans and Other Incentives",China,Mexico,In consultations,"19",December,"2008","6 July 2020"
DS387,"Grants, Loans and Other Incentives",China,United States,In consultations,"19",December,"2008","6 July 2020"
DS386,Certain Country of Origin Labelling Requirements,United States,Mexico,Authorization to retaliate granted,"17",December,"2008","6 July 2020"
DS385,Expiry Reviews of Anti-dumping and Countervailing Duties Imposed on Imports of PET from India,European Communities,India,In consultations,"4",December,"2008","6 July 2020"
DS384,Certain Country of Origin Labelling (Cool) Requirements,United States,Canada,Authorization to retaliate granted,"1",December,"2008","6 July 2020"
DS383,Anti-Dumping Measures on Polyethylene Retail Carrier Bags from Thailand,United States,Thailand,Implementation notified by respondent,"26",November,"2008","6 July 2020"
DS342,Measures Affecting Imports of Automobile Parts,China,Canada,Implementation notified by respondent,"13",April,"2006","6 July 2020"
DS382,Anti-Dumping Administrative Reviews and Other Measures Related to Imports of Certain Orange Juice from Brazil,United States,Brazil,"Settled or terminated (withdrawn, mutually agreed solution)","27",November,"2008","6 July 2020"
DS381,"Measures Concerning the Importation, Marketing and Sale of Tuna and Tuna Products",United States,Mexico,"Authorization to retaliate granted, Compliance proceedings completed without finding of non-compliance","24",October,"2008","6 July 2020"
DS380,Certain Taxes and Other Measures on Imported Wines and Spirits,India,European Communities,In consultations,"22",September,"2008","6 July 2020"
DS379,Definitive Anti-Dumping and Countervailing Duties on Certain Products from China,United States,China,Implementation notified by respondent,"19",September,"2008","6 July 2020"
DS378,Measures Affecting Financial Information Services and Foreign Financial Information Suppliers,China,Canada,"Settled or terminated (withdrawn, mutually agreed solution)","20",June,"2008","6 July 2020"
DS377,Tariff Treatment of Certain Information Technology Products,European Communities,Chinese Taipei,Implementation notified by respondent,"12",June,"2008","6 July 2020"
DS376,Tariff Treatment of Certain Information Technology Products,European Communities,Japan,Implementation notified by respondent,"28",May,"2008","6 July 2020"
DS375,Tariff Treatment of Certain Information Technology Products,European Communities,United States,Implementation notified by respondent,"28",May,"2008","6 July 2020"
DS374,Anti-Dumping Measures on Uncoated Woodfree Paper,South Africa,Indonesia,"Settled or terminated (withdrawn, mutually agreed solution)","9",May,"2008","6 July 2020"
DS373,Measures Affecting Financial Information Services and Foreign Financial Information Suppliers,China,United States,"Settled or terminated (withdrawn, mutually agreed solution)","3",March,"2008","6 July 2020"
DS372,Measures Affecting Financial Information Services and Foreign Financial Information Suppliers,China,European Communities,"Settled or terminated (withdrawn, mutually agreed solution)","3",March,"2008","6 July 2020"
DS371,Customs and Fiscal Measures on Cigarettes from the Philippines,Thailand,Philippines,Compliance proceedings ongoing,"7",February,"2008","6 July 2020"
DS370,Customs Valuation of Certain Products from the European Communities,Thailand,European Communities,In consultations,"25",January,"2008","6 July 2020"
DS369,Certain Measures Prohibiting the Importation and Marketing of Seal Products,European Communities,Canada,"Settled or terminated (withdrawn, mutually agreed solution)","25",September,"2007","6 July 2020"
DS368,Preliminary Anti-Dumping and Countervailing Duty Determinations on Coated Free Sheet Paper from China,United States,China,In consultations,"14",September,"2007","6 July 2020"
DS367,Measures Affecting the Importation of Apples from New Zealand,Australia,New Zealand,Implementation notified by respondent,"31",August,"2007","6 July 2020"
DS366,Indicative Prices and Restrictions on Ports of Entry,Colombia,Panama,Implementation notified by respondent,"12",July,"2007","6 July 2020"
DS365,Domestic Support and Export Credit Guarantees for Agricultural Products,United States,Brazil,"Panel established, but not yet composed","11",July,"2007","6 July 2020"
DS364,Regime for the Importation of Bananas,European Communities,Panama,"Settled or terminated (withdrawn, mutually agreed solution)","22",June,"2007","6 July 2020"
DS363,Measures Affecting Trading Rights and Distribution Services for Certain Publications and Audiovisual Entertainment Products,China,United States,Implementation notified by respondent,"10",April,"2007","6 July 2020"
DS362,Measures Affecting the Protection and Enforcement of Intellectual Property Rights,China,United States,Implementation notified by respondent,"10",April,"2007","6 July 2020"
DS361,Regime for the Importation of Bananas,European Communities,Colombia,"Settled or terminated (withdrawn, mutually agreed solution)","21",March,"2007","6 July 2020"
DS360,Additional and Extra-Additional Duties on Imports from the United States,India,United States,"Report(s) adopted, no further action required","6",March,"2007","6 July 2020"
DS359,"Certain Measures Granting Refunds, Reductions or Exemptions from Taxes and Other Payments",China,Mexico,"Settled or terminated (withdrawn, mutually agreed solution)","26",February,"2007","6 July 2020"
DS358,"Certain Measures Granting Refunds, Reductions or Exemptions from Taxes and Other Payments",China,United States,"Settled or terminated (withdrawn, mutually agreed solution)","2",February,"2007","6 July 2020"
DS357,Subsidies and Other Domestic Support for Corn and Other Agricultural Products,United States,Canada,"Panel established, but not yet composed","8",January,"2007","6 July 2020"
DS356,Definitive Safeguard Measures on Certain Milk Products,Chile,Argentina,Authority for panel lapsed,"28",December,"2006","6 July 2020"
DS355,Anti-dumping Measures on Imports of Certain Resins from Argentina,Brazil,Argentina,Authority for panel lapsed,"26",December,"2006","6 July 2020"
DS354,Tax Exemptions and Reductions for Wine and Beer,Canada,European Communities,"Settled or terminated (withdrawn, mutually agreed solution)","29",November,"2006","6 July 2020"
DS353,Measures Affecting Trade in Large Civil Aircraft,United States,European Communities,Authorization to retaliate requested (including 22.6 arbitration),"27",June,"2005","6 July 2020"
DS352,Measures Affecting the Importation and Sale of Wines and Spirits from the European Communities,India,European Communities,Authority for panel lapsed,"20",November,"2006","6 July 2020"
DS351,Provisional Safeguard Measure on Certain Milk Products,Chile,Argentina,Authority for panel lapsed,"25",October,"2006","6 July 2020"
DS350,Continued Existence and Application of Zeroing Methodology,United States,European Communities,"Report(s) adopted, with recommendation to bring measure(s) into conformity","2",October,"2006","6 July 2020"
DS349,Measures Affecting the Tariff Quota for Fresh or Chilled Garlic,European Communities,Argentina,In consultations,"6",September,"2006","6 July 2020"
DS348,Customs Measures on Importation of Certain Goods from Panama,Colombia,Panama,"Settled or terminated (withdrawn, mutually agreed solution)","20",July,"2006","6 July 2020"
DS347,Measures Affecting Trade in Large Civil Aircraft (Second Complaint),European Communities and Certain Member States,United States,Authority for panel lapsed,"31",January,"2006","6 July 2020"
DS346,Anti-Dumping Administrative Review on Oil Country Tubular Goods from Argentina,United States,Argentina,In consultations,"20",June,"2006","6 July 2020"
DS345,Customs Bond Directive for Merchandise Subject to Anti-Dumping/Countervailing Duties,United States,India,Implementation notified by respondent,"6",June,"2006","6 July 2020"
DS344,Final Anti-Dumping Measures on Stainless Steel from Mexico,United States,Mexico,"Settled or terminated (withdrawn, mutually agreed solution)","26",May,"2006","6 July 2020"
DS343,Measures Relating to Shrimp from Thailand,United States,Thailand,Implementation notified by respondent,"24",April,"2006","6 July 2020"
DS341,Definitive Countervailing Measures on Olive Oil from the European Communities,Mexico,European Communities,Implementation notified by respondent,"31",March,"2006","6 July 2020"
DS340,Measures Affecting Imports of Automobile Parts,China,United States,Implementation notified by respondent,"30",March,"2006","6 July 2020"
DS339,Measures Affecting Imports of Automobile Parts,China,European Communities,Implementation notified by respondent,"30",March,"2006","6 July 2020"
DS338,Provisional Anti-Dumping and Countervailing Duties on Grain Corn from the United States,Canada,United States,In consultations,"17",March,"2006","6 July 2020"
DS337,Anti-Dumping Measure on Farmed Salmon from Norway,European Communities,Norway,"Report(s) adopted, with recommendation to bring measure(s) into conformity","17",March,"2006","6 July 2020"
DS336,Countervailing Duties on Dynamic Random Access Memories from Korea,Japan,"Korea, Republic of",Authority for panel lapsed,"14",March,"2006","6 July 2020"
DS335,Anti-Dumping Measure on Shrimp from Ecuador,United States,Ecuador,Implementation notified by respondent,"17",November,"2005","6 July 2020"
DS334,Measures Affecting the Importation of Rice,Turkey,United States,Implementation notified by respondent,"2",November,"2005","6 July 2020"
DS333,Foreign Exchange Fee Affecting Imports from Costa Rica,Dominican Republic,Costa Rica,In consultations,"12",September,"2005","6 July 2020"
DS332,Measures Affecting Imports of Retreaded Tyres,Brazil,European Communities,Implementation notified by respondent,"20",June,"2005","6 July 2020"
DS331,Anti-Dumping Duties on Steel Pipes and Tubes from Guatemala,Mexico,Guatemala,Implementation notified by respondent,"17",June,"2005","6 July 2020"
DS330,"Countervailing Duties on Olive Oil, Wheat Gluten and Peaches",Argentina,European Communities,In consultations,"29",April,"2005","6 July 2020"
DS329,Tariff Classification of Certain Milk Products,Panama,Mexico,"Settled or terminated (withdrawn, mutually agreed solution)","16",March,"2005","6 July 2020"
DS328,Definitive Safeguard Measure on Salmon,European Communities,Norway,In consultations,"1",March,"2005","6 July 2020"
DS327,Anti-Dumping Duties on Matches from Pakistan,Egypt,Pakistan,"Settled or terminated (withdrawn, mutually agreed solution)","21",February,"2005","6 July 2020"
DS326,Definitive Safeguard Measure on Salmon,European Communities,Chile,"Settled or terminated (withdrawn, mutually agreed solution)","8",February,"2005","6 July 2020"
DS325,Anti-Dumping Determinations regarding Stainless Steel from Mexico,United States,Mexico,In consultations,"5",January,"2005","6 July 2020"
DS324,Provisional Anti-Dumping Measures on Shrimp from Thailand,United States,Thailand,In consultations,"9",December,"2004","6 July 2020"
DS323,Import Quotas on Dried Laver and Seasoned Laver,Japan,"Korea, Republic of","Settled or terminated (withdrawn, mutually agreed solution)","1",December,"2004","6 July 2020"
DS322,Measures Relating to Zeroing and Sunset Reviews,United States,Japan,"Report(s) adopted, with recommendation to bring measure(s) into conformity","24",November,"2004","6 July 2020"
DS321,Continued Suspension of Obligations in the EC,Canada,European Communities,"Report(s) adopted, no further action required","8",November,"2004","6 July 2020"
DS320,Continued Suspension of Obligations in the EC,United States,European Communities,"Report(s) adopted, no further action required","8",November,"2004","6 July 2020"
DS319,Section 776 of the Tariff Act of 1930,United States,European Communities,In consultations,"5",November,"2004","6 July 2020"
DS318,"Anti-Dumping Measures on Certain Products from the Separate Customs Territory of Taiwan, Penghu, Kinmen and Matsu",India,Chinese Taipei,In consultations,"28",October,"2004","6 July 2020"
DS317,Measures Affecting Trade in Large Civil Aircraft,United States,European Communities,Panel composed,"6",October,"2004","6 July 2020"
DS316,Measures Affecting Trade in Large Civil Aircraft,European Communities and Certain Member States,United States,"Compliance proceedings ongoing, Authorization to retaliate granted","6",October,"2004","6 July 2020"
DS315,Selected Customs Matters,European Communities,United States,Implementation notified by respondent,"21",September,"2004","6 July 2020"
DS314,Provisional Countervailing Measures on Olive Oil from the European Communities,Mexico,European Communities,In consultations,"18",August,"2004","6 July 2020"
DS313,Anti-Dumping Duties on Certain Flat Rolled Iron or Non-Alloy Steel Products from India,European Communities,India,"Settled or terminated (withdrawn, mutually agreed solution)","5",July,"2004","6 July 2020"
DS312,Anti-Dumping Duties on Imports of Certain Paper from Indonesia,"Korea, Republic of",Indonesia,Compliance proceedings completed with finding(s) of non-compliance,"4",June,"2004","6 July 2020"
DS311,Reviews of Countervailing Duty on Softwood Lumber from Canada,United States,Canada,"Settled or terminated (withdrawn, mutually agreed solution)","14",April,"2004","6 July 2020"
DS310,Determination of the International Trade Commission in Hard Red Spring Wheat from Canada,United States,Canada,In consultations,"8",April,"2004","6 July 2020"
DS309,Value-Added Tax on Integrated Circuits,China,United States,"Settled or terminated (withdrawn, mutually agreed solution)","18",March,"2004","6 July 2020"
DS308,Tax Measures on Soft Drinks and Other Beverages,Mexico,United States,Implementation notified by respondent,"16",March,"2004","6 July 2020"
DS307,Aid for Commercial Vessels,European Communities,"Korea, Republic of",In consultations,"13",February,"2004","6 July 2020"
DS306,Anti-Dumping Measure on Batteries from Bangladesh,India,Bangladesh,"Settled or terminated (withdrawn, mutually agreed solution)","28",January,"2004","6 July 2020"
DS305,Measures Affecting Imports of Textile and Apparel Products,Egypt,United States,"Settled or terminated (withdrawn, mutually agreed solution)","23",December,"2003","6 July 2020"
DS304,Anti-Dumping Measures on Imports of Certain Products from the European Communities,India,European Communities,In consultations,"8",December,"2003","6 July 2020"
DS303,Definitive Safeguard Measure on Imports of Medium Density Fibreboard,Ecuador,Chile,In consultations,"24",November,"2003","6 July 2020"
DS302,Measures Affecting the Importation and Internal Sale of Cigarettes,Dominican Republic,Honduras,"Report(s) adopted, with recommendation to bring measure(s) into conformity","8",October,"2003","6 July 2020"
DS301,Measures Affecting Trade in Commercial Vessels,European Communities,"Korea, Republic of",Mutually acceptable solution on implementation notified,"3",September,"2003","6 July 2020"
DS300,Measures Affecting the Importation of Cigarettes,Dominican Republic,Honduras,In consultations,"28",August,"2003","6 July 2020"
DS299,Countervailing Measures on Dynamic Random Access Memory Chips from Korea,European Communities,"Korea, Republic of",Implementation notified by respondent,"25",July,"2003","6 July 2020"
DS298,Certain Pricing Measures for Customs Valuation and Other Purposes,Mexico,Guatemala,"Settled or terminated (withdrawn, mutually agreed solution)","22",July,"2003","6 July 2020"
DS297,Measures Affecting Imports of Live Animals and Meat Products,Croatia,Hungary,"Settled or terminated (withdrawn, mutually agreed solution)","9",July,"2003","6 July 2020"
DS296,Countervailing Duty Investigation on Dynamic Random Access Memory Semiconductors (DRAMS) from Korea,United States,"Korea, Republic of",Implementation notified by respondent,"30",June,"2003","6 July 2020"
DS295,Definitive Anti-Dumping Measures on Beef and Rice,Mexico,United States,"Report(s) adopted, with recommendation to bring measure(s) into conformity","16",June,"2003","6 July 2020"
DS294,"Laws, Regulations and Methodology for Calculating Dumping Margins (Zeroing)",United States,European Communities,"Report(s) adopted, with recommendation to bring measure(s) into conformity","12",June,"2003","6 July 2020"
DS293,Measures Affecting the Approval and Marketing of Biotech Products,European Communities,Argentina,"Settled or terminated (withdrawn, mutually agreed solution)","14",May,"2003","6 July 2020"
DS292,Measures Affecting the Approval and Marketing of Biotech Products,European Communities,Canada,"Settled or terminated (withdrawn, mutually agreed solution)","13",May,"2003","6 July 2020"
DS291,Measures Affecting the Approval and Marketing of Biotech Products,European Communities,United States,Authorization to retaliate requested (including 22.6 arbitration),"13",May,"2003","6 July 2020"
DS290,Protection of Trademarks and Geographical Indications for Agricultural Products and Foodstuffs,European Communities,Australia,Implementation notified by respondent,"17",April,"2003","6 July 2020"
DS289,Additional Duty on Imports of Pig-Meat from Poland,Czech Republic,Poland,In consultations,"16",April,"2003","6 July 2020"
DS288,Definitive Anti-Dumping Measures on Blanketing from Turkey,South Africa,Turkey,In consultations,"9",April,"2003","6 July 2020"
