"ds_num","title","resp","comp","status","consultations_requested_date","consultations_requested_month","consultations_requested_year","date_added"
DS595,Safeguard Measures on Certain Steel Products,European Union,Turkey,In consultations,"13",March,"2020","6 July 2020"
DS594,Measures Affecting Trade in Commercial Vessels (second complaint) (Japan),"Korea, Republic of",Japan,In consultations,"31",January,"2020","6 July 2020"
DS593,Certain measures concerning palm oil and oil palm crop-based biofuels,European Union,Indonesia,In consultations,"9",December,"2019","6 July 2020"
DS592,Measures Relating to Raw Materials,Indonesia,European Union,In consultations,"22",November,"2019","6 July 2020"
DS591,"Anti-Dumping Duties on Frozen Fries from Belgium, Germany and the Netherlands",Colombia,European Union,"Panel established, but not yet composed","15",November,"2019","6 July 2020"
DS590,Measures Related to the Exportation of Products and Technology to Korea,Japan,"Korea, Republic of",In consultations,"11",September,"2019","6 July 2020"
DS589,Measures Concerning the Importation of Canola Seed from Canada,China,Canada,In consultations,"9",September,"2019","6 July 2020"
DS588,Tariff Treatment on Certain Good in the Information and Communications Technology Sector,India,Chinese Taipei,In consultations,"2",September,"2019","6 July 2020"
DS587,Tariff measures on certain goods from China III,United States,China,In consultations,"2",September,"2019","6 July 2020"
DS586,Anti-Dumping Measures on Carbon-Quality Steel from Russia,United States,Russian Federation,In consultations,"5",July,"2019","6 July 2020"
DS585,Additional duties on certain products from the United States,India,United States,Panel composed,"3",July,"2019","6 July 2020"
DS584,Tariff Treatment on Certain Goods,India,Japan,In consultations,"10",May,"2019","6 July 2020"
DS583,"Certain Measures concerning the Production, Importation and Marketing of Pharmaceutical Products",Turkey,European Union,Panel composed,"2",April,"2019","6 July 2020"
DS582,Tariff Treatment on Certain Good in the Information and Communications Technology Sector,India,European Union,"Panel established, but not yet composed","2",April,"2019","6 July 2020"
DS581,Measures Concerning Sugar and Sugarcane,India,Guatemala,Panel composed,"15",March,"2019","6 July 2020"
DS580,Measures Concerning Sugar and Sugarcane,India,Australia,Panel composed,"1",March,"2019","6 July 2020"
DS579,Measures Concerning Sugar and Sugarcane,India,Brazil,Panel composed,"27",February,"2019","6 July 2020"
DS578,Definitive Anti-Dumping Measures on School Exercise Books from Tunisia,Morocco,Tunisia,Panel composed,"21",February,"2019","6 July 2020"
DS577,Anti-dumping and countervailing duties on ripe olives from Spain,United States,European Union,Panel composed,"29",January,"2019","6 July 2020"
DS576,Certain measures concerning goods from the United Arab Emirates,Qatar,United Arab Emirates,"Panel established, but not yet composed","28",January,"2019","6 July 2020"
DS575,Measures concerning the distribution of liquid fuels,Colombia,"Venezuela, Bolivarian Republic of",In consultations,"9",January,"2019","6 July 2020"
DS574,Measures relating to trade in goods and services,United States,"Venezuela, Bolivarian Republic of",In consultations,"28",December,"2018","6 July 2020"
DS573,Additional duties on imports of air conditioning machines from Thailand,Turkey,Thailand,Panel composed,"5",December,"2018","6 July 2020"
DS572,Anti-dumping and countervailing measures on biodiesel from Argentina,Peru,Argentina,In consultations,"29",November,"2018","6 July 2020"
DS571,Measures Affecting Trade in Commercial Vessels (Japan),"Korea, Republic of",Japan,In consultations,"6",November,"2018","6 July 2020"
DS570,Anti-Dumping Measures on Steel Pipes,Kyrgyz Republic,Ukraine,In consultations,"17",October,"2018","6 July 2020"
DS569,Anti-Dumping Measures on Steel Pipes,Armenia,Ukraine,In consultations,"17",October,"2018","6 July 2020"
DS568,Certain Measures Concerning Imports of Sugar,China,Brazil,In consultations,"16",October,"2018","6 July 2020"
DS567,Measures concerning the Protection of Intellectual Property Rights,"Saudi Arabia, Kingdom of",Qatar,Panel report circulated,"1",October,"2018","6 July 2020"
DS566,Additional Duties on Certain Products from the United States,Russian Federation,United States,Panel composed,"27",August,"2018","6 July 2020"
DS565,Tariff Measures on Certain Goods from China II,United States,China,In consultations,"23",August,"2018","6 July 2020"
DS564,Certain Measures on Steel and Aluminium Products,United States,Turkey,Panel composed,"15",August,"2018","6 July 2020"
DS563,Certain Measures Related to Renewable Energy,United States,China,In consultations,"14",August,"2018","6 July 2020"
DS562,Safeguard Measure on Imports of Crystalline Silicon Photovoltaic Products,United States,China,Panel composed,"14",August,"2018","6 July 2020"
DS561,Additional Duties on Certain Products from the United States,Turkey,United States,Panel composed,"16",July,"2018","6 July 2020"
DS560,Additional Duties on Certain Products from the United States,Mexico,United States,"Settled or terminated (withdrawn, mutually agreed solution)","16",July,"2018","6 July 2020"
DS559,Additional Duties on Certain Products from the United States,European Union,United States,Panel composed,"16",July,"2018","6 July 2020"
DS558,Additional Duties on Certain Products from the United States,China,United States,Panel composed,"16",July,"2018","6 July 2020"
DS557,Additional Duties on Certain Products from the United States,Canada,United States,"Settled or terminated (withdrawn, mutually agreed solution)","16",July,"2018","6 July 2020"
DS556,Certain Measures on Steel and Aluminium Products,United States,Switzerland,Panel composed,"9",July,"2018","6 July 2020"
DS555,Provisional Anti-Dumping Measures on School Exercise Books from Tunisia,Morocco,Tunisia,In consultations,"5",July,"2018","6 July 2020"
DS554,Certain Measures on Steel and Aluminium Products,United States,Russian Federation,Panel composed,"29",June,"2018","6 July 2020"
DS553,Sunset Review of Anti-Dumping Duties on Stainless Steel Bars,"Korea, Republic of",Japan,Panel composed,"18",June,"2018","6 July 2020"
DS552,Certain Measures on Steel and Aluminium Products,United States,Norway,Panel composed,"12",June,"2018","6 July 2020"
DS551,Certain Measures on Steel and Aluminium Products,United States,Mexico,"Settled or terminated (withdrawn, mutually agreed solution)","5",June,"2018","6 July 2020"
DS550,Certain Measures on Steel and Aluminium Products,United States,Canada,"Settled or terminated (withdrawn, mutually agreed solution)","1",June,"2018","6 July 2020"
DS549,Certain Measures on the Transfer of Technology,China,European Union,In consultations,"1",June,"2018","6 July 2020"
DS548,Certain Measures on Steel and Aluminium Products,United States,European Union,Panel composed,"1",June,"2018","6 July 2020"
DS547,Certain Measures on Steel and Aluminium Products,United States,India,Panel composed,"18",May,"2018","6 July 2020"
DS546,Safeguard measure on imports of large residential washers,United States,"Korea, Republic of",Panel composed,"14",May,"2018","6 July 2020"
DS545,Safeguard measure on imports of crystalline silicon photovoltaic products,United States,"Korea, Republic of","Panel established, but not yet composed","14",May,"2018","6 July 2020"
DS544,Certain Measures on Steel and Aluminium Products,United States,China,Panel composed,"5",April,"2018","6 July 2020"
DS543,Tariff Measures on Certain Goods from China,United States,China,Panel composed,"4",April,"2018","6 July 2020"
DS542,Certain Measures Concerning the Protection of Intellectual Property Rights,China,United States,Panel composed,"23",March,"2018","6 July 2020"
DS541,Export Related Measures,India,United States,Panel report under appeal,"14",March,"2018","6 July 2020"
DS540,Certain Measures Concerning Pangasius Seafood Products from Viet Nam,United States,Viet Nam,In consultations,"22",February,"2018","6 July 2020"
DS539,Anti-dumping and Countervailing Duties on Certain Products and the Use of Facts Available,United States,"Korea, Republic of",Panel composed,"14",February,"2018","6 July 2020"
DS538,Anti-Dumping Measures on Biaxially Oriented Polypropylene Film from the United Arab Emirates,Pakistan,United Arab Emirates,Panel composed,"24",January,"2018","6 July 2020"
DS537,Measures Governing the Sale of Wine,Canada,Australia,Panel composed,"12",January,"2018","6 July 2020"
DS536,Anti-Dumping Measures on Fish Fillets from Viet nam,United States,Viet Nam,Panel composed,"8",January,"2018","6 July 2020"
DS535,Certain Systemic Trade Remedies Measures,United States,Canada,In consultations,"20",December,"2017","6 July 2020"
DS534,Anti-Dumping Measures Applying Differential Pricing Methodology to Softwood Lumber from Canada,United States,Canada,Panel report under appeal,"28",November,"2017","6 July 2020"
DS533,Countervailing Measures on Softwood Lumber from Canada,United States,Canada,Panel composed,"28",November,"2017","6 July 2020"
DS532,Measures Concerning the Importation and Transit of Certain Ukrainian Products,Russian Federation,Ukraine,In consultations,"13",October,"2017","6 July 2020"
DS531,Measures Governing the Sale of Wine in Grocery Stores (second complaint),Canada,United States,"Panel established, but not yet composed","28",September,"2017","6 July 2020"
DS530,Anti-dumping Measures on Steel Pipes,Kazakhstan,Ukraine,In consultations,"19",September,"2017","6 July 2020"
DS529,Anti-Dumping Measures on A4 Copy Paper,Australia,Indonesia,"Report(s) adopted, with recommendation to bring measure(s) into conformity","1",September,"2017","6 July 2020"
DS528,"Measures Relating to Trade in Goods and Services, and Trade-Related Aspects of Intellectual Property Rights","Saudi Arabia, Kingdom of",Qatar,In consultations,"31",July,"2017","6 July 2020"
DS527,"Measures Relating to Trade in Goods and Services, and Trade-Related Aspects of Intellectual Property Rights","Bahrain, Kingdom of",Qatar,In consultations,"31",July,"2017","6 July 2020"
DS526,"Measures Relating to Trade in Goods and Services, and Trade-Related Aspects of Intellectual Property Rights",United Arab Emirates,Qatar,Panel composed,"31",July,"2017","6 July 2020"
DS525,Measures relating to Trade in Goods and Services,Ukraine,Russian Federation,In consultations,"19",May,"2017","6 July 2020"
DS524,Measures Concerning the Importation of Fresh Avocados from Mexico,Costa Rica,Mexico,Panel composed,"8",March,"2017","6 July 2020"
DS523,Countervailing Measures on Certain Pipe and Tube Products (Turkey),United States,Turkey,Panel report under appeal,"8",March,"2017","6 July 2020"
DS522,Measures Concerning Trade in Commercial Aircraft,Canada,Brazil,Panel composed,"8",February,"2017","6 July 2020"
DS521,Anti-Dumping Measures on Certain Cold-Rolled Flat Steel Products from Russia,European Union,Russian Federation,Panel composed,"27",January,"2017","6 July 2020"
DS520,Measures Governing the Sale of Wine in Grocery Stores,Canada,United States,In consultations,"18",January,"2017","6 July 2020"
DS519,Subsidies to Producers of Primary Aluminium,China,United States,In consultations,"12",January,"2017","6 July 2020"
DS518,Certain Measures on Imports of Iron and Steel Products,India,Japan,Panel report under appeal,"20",December,"2016","6 July 2020"
DS517,Tariff Rate Quotas for Certain Agricultural Products,China,United States,"Report(s) adopted, with recommendation to bring measure(s) into conformity","15",December,"2016","6 July 2020"
DS516,Measures Related to Price Comparison Methodologies,European Union,China,Authority for panel lapsed,"12",December,"2016","6 July 2020"
DS515,Measures Related to Price Comparison Methodologies,United States,China,In consultations,"12",December,"2016","6 July 2020"
DS514,Countervailing Measures on Cold- and Hot-Rolled Steel Flat Products from Brazil,United States,Brazil,In consultations,"11",November,"2016","6 July 2020"
DS513,Anti-Dumping Measures on Certain Hot-Rolled Steel from Turkey,Morocco,Turkey,"Report(s) adopted, with recommendation to bring measure(s) into conformity","3",October,"2016","6 July 2020"
DS512,Measures Concerning Traffic in Transit,Russian Federation,Ukraine,"Report(s) adopted, no further action required","14",September,"2016","6 July 2020"
DS511,Domestic Support for Agricultural Producers,China,United States,"Report(s) adopted, with recommendation to bring measure(s) into conformity","13",September,"2016","6 July 2020"
DS510,Certain Measures Relating to the Renewable Energy Sector,United States,India,Panel report under appeal,"9",September,"2016","6 July 2020"
DS509,Duties and other Measures concerning the Exportation of Certain Raw Materials,China,European Union,"Panel established, but not yet composed","19",July,"2016","6 July 2020"
DS508,Export Duties on Certain Raw Materials,China,United States,"Panel established, but not yet composed","13",July,"2016","6 July 2020"
DS507,Subsidies concerning Sugar,Thailand,Brazil,In consultations,"4",April,"2016","6 July 2020"
DS506,Measures Concerning the Importation of Bovine Meat,Indonesia,Brazil,In consultations,"4",April,"2016","6 July 2020"
DS505,Countervailing Measures on Supercalendered Paper from Canada,United States,Canada,"Report(s) adopted, with recommendation to bring measure(s) into conformity","30",March,"2016","6 July 2020"
DS504,Anti-Dumping Duties on Pneumatic Valves from Japan,"Korea, Republic of",Japan,"Report(s) adopted, with recommendation to bring measure(s) into conformity","15",March,"2016","6 July 2020"
DS503,Measures Concerning Non-Immigrant Visas,United States,India,In consultations,"3",March,"2016","6 July 2020"
DS502,Measures Concerning Imported Spirits,Colombia,European Union,"Panel established, but not yet composed","13",January,"2016","6 July 2020"
DS501,Tax Measures Concerning Certain Domestically Produced Aircraft,China,United States,In consultations,"8",December,"2015","6 July 2020"
DS500,Provisional Anti-Dumping Duties on Portland Cement from Pakistan,South Africa,Pakistan,In consultations,"9",November,"2015","6 July 2020"
DS499,Measures affecting the importation of railway equipment and parts thereof,Russian Federation,Ukraine,"Report(s) adopted, with recommendation to bring measure(s) into conformity","21",October,"2015","6 July 2020"
DS498,"Anti-Dumping Duties on USB Flash Drives from the Separate Customs Territory of Taiwan, Penghu, Kinmen and Matsu",India,Chinese Taipei,In consultations,"24",September,"2015","6 July 2020"
DS497,Certain Measures Concerning Taxation and Charges,Brazil,Japan,"Report(s) adopted, with recommendation to bring measure(s) into conformity","2",July,"2015","6 July 2020"
DS496,Safeguard on Certain Iron or Steel Products,Indonesia,Viet Nam,"Report(s) adopted, with recommendation to bring measure(s) into conformity","1",June,"2015","6 July 2020"
DS495,"Import Bans, and Testing and Certification Requirements for Radionuclides","Korea, Republic of",Japan,"Report(s) adopted, with recommendation to bring measure(s) into conformity","21",May,"2015","6 July 2020"
DS494,Cost Adjustment Methodologies and Certain Anti-Dumping Measures on Imports from Russia (Second complaint),European Union,Russian Federation,Panel composed,"7",May,"2015","6 July 2020"
DS493,Anti-Dumping Measures on Ammonium Nitrate,Ukraine,Russian Federation,"Report(s) adopted, with recommendation to bring measure(s) into conformity","7",May,"2015","6 July 2020"
DS492,Measures Affecting Tariff Concessions on Certain Poultry Meat Products,European Union,China,"Settled or terminated (withdrawn, mutually agreed solution)","8",April,"2015","6 July 2020"
DS491,Anti-Dumping and Countervailing Measures on Certain Coated Paper from Indonesia,United States,Indonesia,"Report(s) adopted, no further action required","13",March,"2015","6 July 2020"
DS490,Safeguard on Certain Iron or Steel Products,Indonesia,Chinese Taipei,"Report(s) adopted, with recommendation to bring measure(s) into conformity","12",February,"2015","6 July 2020"
DS489,Measures Related to Demonstration Bases and common Service Platforms Programmes,China,United States,"Panel established, but not yet composed","11",February,"2015","6 July 2020"
DS488,Anti-Dumping Measures on Certain Oil Country Tubular Goods from Korea,United States,"Korea, Republic of",Authorization to retaliate requested (including 22.6 arbitration),"22",December,"2014","6 July 2020"
DS487,Conditional Tax Incentives for Large Civil Aircraft,United States,European Union,"Report(s) adopted, no further action required","19",December,"2014","6 July 2020"
DS486,Countervailing Measures on Certain Polyethylene Terephthalate from Pakistan,European Union,Pakistan,"Report(s) adopted, no further action required","5",November,"2014","6 July 2020"
DS485,Tariff Treatment of Certain Agricultural and Manufacturing Products,Russian Federation,European Union,"Report(s) adopted, with recommendation to bring measure(s) into conformity","31",October,"2014","6 July 2020"
DS484,Measures Concerning the Importation of Chicken Meat and Chicken Products,Indonesia,Brazil,Compliance proceedings ongoing,"16",October,"2014","6 July 2020"
DS483,Anti-Dumping Measures on Imports of Cellulose Pulp from Canada,China,Canada,Implementation notified by respondent,"15",October,"2014","6 July 2020"
DS482,"Anti-Dumping Measures on Imports of Certain Carbon Steel Welded Pipe from The Separate Customs Territory of Taiwan, Penghu, Kinmen and Matsu",Canada,Chinese Taipei,"Report(s) adopted, with recommendation to bring measure(s) into conformity","25",June,"2014","6 July 2020"
DS481,Recourse to article 22.2 of the DSU in the US,Indonesia,European Union,"Settled or terminated (withdrawn, mutually agreed solution)","13",June,"2014","6 July 2020"
DS480,Anti-Dumping Measures on Biodiesel from Indonesia,European Union,Indonesia,"Report(s) adopted, with recommendation to bring measure(s) into conformity","10",June,"2014","6 July 2020"
DS479,Anti-Dumping Duties on Light Commercial Vehicles from Germany and Italy,Russian Federation,European Union,"Report(s) adopted, with recommendation to bring measure(s) into conformity","21",May,"2014","6 July 2020"
DS478,"Importation of Horticultural Products, Animals and Animal Products",Indonesia,United States,Authorization to retaliate requested (including 22.6 arbitration),"8",May,"2014","6 July 2020"
DS477,"Importation of Horticultural Products, Animals and Animal Products",Indonesia,New Zealand,"Report(s) adopted, with recommendation to bring measure(s) into conformity","8",May,"2014","6 July 2020"
DS476,Certain Measures Relating to the Energy Sector,European Union,Russian Federation,Panel report under appeal,"30",April,"2014","6 July 2020"
DS475,"Measures on the Importation of Live Pigs, Pork and Other Pig Products from the European Union",Russian Federation,European Union,Compliance proceedings ongoing,"8",April,"2014","6 July 2020"
DS474,Cost Adjustment Methodologies and Certain Anti-Dumping Measures on Imports from Russia,European Union,Russian Federation,"Panel established, but not yet composed","23",December,"2013","6 July 2020"
DS473,Anti-Dumping Measures on Biodiesel from Argentina,European Union,Argentina,"Report(s) adopted, with recommendation to bring measure(s) into conformity","19",December,"2013","6 July 2020"
DS472,Certain Measures Concerning Taxation and Charges,Brazil,European Union,"Report(s) adopted, with recommendation to bring measure(s) into conformity","19",December,"2013","6 July 2020"
DS471,Certain Methodologies and their Application to Anti-Dumping Proceedings Involving China,United States,China,Authorization to retaliate requested (including 22.6 arbitration),"3",December,"2013","6 July 2020"
DS470,Anti-Dumping and Countervailing Duty Investigations on Certain Paper Products from Indonesia,Pakistan,Indonesia,In consultations,"27",November,"2013","6 July 2020"
DS469,Measures on Atlanto-Scandian Herring,European Union,Denmark,"Settled or terminated (withdrawn, mutually agreed solution)","4",November,"2013","6 July 2020"
DS468,Definitive Safeguard Measures on Certain Passenger Cars,Ukraine,Japan,"Report(s) adopted, with recommendation to bring measure(s) into conformity","30",October,"2013","6 July 2020"
DS467,"Certain Measures Concerning Trademarks, Geographical Indications and Other Plain Packaging Requirements Applicable to Tobacco Products and Packaging",Australia,Indonesia,"Report(s) adopted, no further action required","20",September,"2013","6 July 2020"
DS466,"Importation of Horticultural Products, Animals and Animal Products",Indonesia,New Zealand,In consultations,"30",August,"2013","6 July 2020"
DS465,"Importation of Horticultural Products, Animals and Animal Products",Indonesia,United States,In consultations,"30",August,"2013","6 July 2020"
DS464,Anti-Dumping and Countervailing Measures on Large Residential Washers from Korea,United States,"Korea, Republic of",Authorization to retaliate requested (including 22.6 arbitration),"29",August,"2013","6 July 2020"
DS463,Recycling Fee on Motor Vehicles,Russian Federation,Japan,In consultations,"24",July,"2013","6 July 2020"
DS462,Recycling Fee on Motor Vehicles,Russian Federation,European Union,"Panel established, but not yet composed","9",July,"2013","6 July 2020"
DS461,"Measures Relating to the Importation of Textiles, Apparel and Footwear",Colombia,Panama,"Authorization to retaliate requested (including 22.6 arbitration), Compliance proceedings ongoing","18",June,"2013","6 July 2020"
DS460,Measures Imposing Anti-Dumping Duties on High-Performance Stainless Steel Seamless Tubes (HP-SSST) from the European Union,China,European Union,"Report(s) adopted, with recommendation to bring measure(s) into conformity","13",June,"2013","6 July 2020"
DS459,Certain Measures on the Importation and Marketing of Biodiesel and Measures Supporting the Biodiesel Industry,European Union,Argentina,In consultations,"15",May,"2013","6 July 2020"
DS458,"Certain Measures Concerning Trademarks, Geographical Indications and Other Plain Packaging Requirements Applicable to Tobacco Products and Packaging",Australia,Cuba,"Report(s) adopted, no further action required","3",May,"2013","6 July 2020"
DS457,Additional Duty on Imports of Certain Agricultural Products,Peru,Guatemala,"Report(s) adopted, with recommendation to bring measure(s) into conformity","12",April,"2013","6 July 2020"
DS456,Certain Measures Relating to Solar Cells and Solar Modules,India,United States,"Authorization to retaliate requested (including 22.6 arbitration), Compliance proceedings ongoing","6",February,"2013","6 July 2020"
DS455,"Importation of horticultural products, animals and animal products",Indonesia,United States,"Panel established, but not yet composed","10",January,"2013","6 July 2020"
DS454,Measures Imposing Anti-Dumping Duties on High-Performance Stainless Steel Seamless Tubes (HP-SSST) from Japan,China,Japan,"Report(s) adopted, with recommendation to bring measure(s) into conformity","20",December,"2012","6 July 2020"
DS453,Measures Relating to Trade in Goods and Services,Argentina,Panama,"Report(s) adopted, no further action required","12",December,"2012","6 July 2020"
DS452,Certain Measures Affecting the Renewable Energy Generation Sector,European Union and Certain Member States,China,In consultations,"5",November,"2012","6 July 2020"
DS451,Measures Relating to the Production and Exportation of Apparel and Textile Products,China,Mexico,In consultations,"15",October,"2012","6 July 2020"
DS450,Certain Measures Affecting the Automobile and Automobile-Parts Industries,China,United States,In consultations,"17",September,"2012","6 July 2020"
DS449,Countervailing and Anti-dumping Measures on Certain Products from China,United States,China,"Report(s) adopted, with recommendation to bring measure(s) into conformity","17",September,"2012","6 July 2020"
DS448,Measures Affecting the Importation of Fresh Lemons,United States,Argentina,In consultations,"3",September,"2012","6 July 2020"
DS447,"Measures Affecting the Importation of Animals, Meat and Other Animal Products from Argentina",United States,Argentina,"Report(s) adopted, with recommendation to bring measure(s) into conformity","30",August,"2012","6 July 2020"
DS446,Measures Affecting the Importation of Goods,Argentina,Mexico,In consultations,"24",August,"2012","6 July 2020"
DS445,Measures Affecting the Importation of Goods,Argentina,Japan,"Report(s) adopted, with recommendation to bring measure(s) into conformity","21",August,"2012","6 July 2020"
DS444,Measures Affecting the Importation of Goods,Argentina,United States,"Report(s) adopted, with recommendation to bring measure(s) into conformity","21",August,"2012","6 July 2020"
DS443,Certain Measures Concerning the Importation of Biodiesels,European Union and a Member State,Argentina,In consultations,"17",August,"2012","6 July 2020"
DS442,Anti-Dumping Measures on Imports of Certain Fatty Alcohols from Indonesia,European Union,Indonesia,"Report(s) adopted, with recommendation to bring measure(s) into conformity","30",July,"2012","6 July 2020"
DS441,"Certain Measures Concerning Trademarks, Geographical Indications and Other Plain Packaging Requirements Applicable to Tobacco Products and Packaging",Australia,Dominican Republic,"Report(s) adopted, no further action required","18",July,"2012","6 July 2020"
DS440,Anti-Dumping and Countervailing Duties on Certain Automobiles from the United States,China,United States,"Report(s) adopted, no further action required","5",July,"2012","6 July 2020"
DS439,Anti-Dumping Duties on Frozen Meat of Fowls from Brazil,South Africa,Brazil,In consultations,"21",June,"2012","6 July 2020"
DS438,Measures Affecting the Importation of Goods,Argentina,European Union,"Report(s) adopted, with recommendation to bring measure(s) into conformity","25",May,"2012","6 July 2020"
