"ds_num","title","resp","comp","status","consultations_requested_date","consultations_requested_month","consultations_requested_year","date_added"
DS130,Certain Income Tax Measures Constituting Subsidies,Ireland,United States,In consultations,"5",May,"1998","6 July 2020"
DS129,Certain Income Tax Measures Constituting Subsidies,Greece,United States,In consultations,"5",May,"1998","6 July 2020"
DS128,Certain Income Tax Measures Constituting Subsidies,Netherlands,United States,In consultations,"5",May,"1998","6 July 2020"
DS126,Subsidies Provided to Producers and Exporters of Automotive Leather,Australia,United States,Mutually acceptable solution on implementation notified,"4",May,"1998","6 July 2020"
DS125,Enforcement of Intellectual Property Rights for Motion Pictures and Television Programs,Greece,United States,"Settled or terminated (withdrawn, mutually agreed solution)","4",May,"1998","6 July 2020"
DS124,Enforcement of Intellectual Property Rights for Motion Pictures and Television Programs,European Communities,United States,"Settled or terminated (withdrawn, mutually agreed solution)","30",April,"1998","6 July 2020"
DS123,Safeguard Measures on Imports of Footwear,Argentina,Indonesia,In consultations,"22",April,"1998","6 July 2020"
DS122,"Anti-Dumping Duties on Angles, Shapes and Sections of Iron or Non-Alloy Steel and H Beams from Poland",Thailand,Poland,Implementation notified by respondent,"6",April,"1998","6 July 2020"
DS121,Safeguard Measures on Imports of Footwear,Argentina,European Communities,Implementation notified by respondent,"6",April,"1998","6 July 2020"
DS120,Measures Affecting Export of Certain Commodities,India,European Communities,In consultations,"11",March,"1998","6 July 2020"
DS119,Anti-Dumping Measures on Imports of Coated Woodfree Paper Sheets,Australia,Switzerland,"Settled or terminated (withdrawn, mutually agreed solution)","20",February,"1998","6 July 2020"
DS118,Harbour Maintenance Tax,United States,European Communities,In consultations,"6",February,"1998","6 July 2020"
DS117,Measures Affecting Film Distribution Services,Canada,European Communities,In consultations,"20",January,"1998","6 July 2020"
DS116,Measures Affecting Payment Terms for Imports,Brazil,European Communities,In consultations,"8",January,"1998","6 July 2020"
DS115,Measures Affecting the Grant of Copyright and Neighbouring Rights,European Communities,United States,"Settled or terminated (withdrawn, mutually agreed solution)","6",January,"1998","6 July 2020"
DS114,Patent Protection of Pharmaceutical Products,Canada,European Communities,Implementation notified by respondent,"19",December,"1997","6 July 2020"
DS113,Measures Affecting Dairy Exports,Canada,New Zealand,Mutually acceptable solution on implementation notified,"29",December,"1997","6 July 2020"
DS112,Countervailing Duty Investigation against Imports of Buses from Brazil,Peru,Brazil,In consultations,"23",December,"1997","6 July 2020"
DS111,Tariff Rate Quota for Imports of Groundnuts,United States,Argentina,In consultations,"19",December,"1997","6 July 2020"
DS110,Taxes on Alcoholic Beverages,Chile,European Communities,Implementation notified by respondent,"15",December,"1997","6 July 2020"
DS109,Taxes on Alcoholic Beverages,Chile,United States,In consultations,"11",December,"1997","6 July 2020"
DS108,Tax Treatment for Foreign Sales Corporations,United States,European Communities,Mutually acceptable solution on implementation notified,"18",November,"1997","6 July 2020"
DS107,Export Measures Affecting Hides and Skins,Pakistan,European Communities,In consultations,"7",November,"1997","6 July 2020"
DS106,Subsidies Provided to Producers and Exporters of Automotive Leather,Australia,United States,"Settled or terminated (withdrawn, mutually agreed solution)","10",November,"1997","6 July 2020"
DS105,"Regime for the Importation, Sale and Distribution of Bananas",European Communities,Panama,"Settled or terminated (withdrawn, mutually agreed solution)","24",October,"1997","6 July 2020"
DS104,Measures Affecting the Exportation of Processed Cheese,European Communities,United States,In consultations,"8",October,"1997","6 July 2020"
DS103,Measures Affecting the Importation of Milk and the Exportation of Dairy Products,Canada,United States,Mutually acceptable solution on implementation notified,"8",October,"1997","6 July 2020"
DS102,Measures Affecting Pork and Poultry,Philippines,United States,"Settled or terminated (withdrawn, mutually agreed solution)","7",October,"1997","6 July 2020"
DS101,Anti-Dumping Investigation of High-Fructose Corn Syrup (HFCS) from the United States,Mexico,United States,In consultations,"4",September,"1997","6 July 2020"
DS100,Measures Affecting Imports of Poultry Products,United States,European Communities,In consultations,"18",August,"1997","6 July 2020"
DS99,Anti-Dumping Duty on Dynamic Random Access Memory Semiconductors (DRAMS) of One Megabit or Above from Korea,United States,"Korea, Republic of",Mutually acceptable solution on implementation notified,"14",August,"1997","6 July 2020"
DS98,Definitive Safeguard Measure on Imports of Certain Dairy Products,"Korea, Republic of",European Communities,Implementation notified by respondent,"12",August,"1997","6 July 2020"
DS97,Countervailing Duty Investigation of Imports of Salmon from Chile,United States,Chile,In consultations,"5",August,"1997","6 July 2020"
DS96,"Quantitative Restrictions on Imports of Agricultural, Textile and Industrial Products",India,European Communities,"Settled or terminated (withdrawn, mutually agreed solution)","18",July,"1997","6 July 2020"
DS95,Measure Affecting Government Procurement,United States,Japan,Authority for panel lapsed,"18",July,"1997","6 July 2020"
DS94,"Quantitative Restrictions on Imports of Agricultural, Textile and Industrial Products",India,Switzerland,"Settled or terminated (withdrawn, mutually agreed solution)","17",July,"1997","6 July 2020"
DS93,"Quantitative Restrictions on Imports of Agricultural, Textile and Industrial Products",India,New Zealand,"Settled or terminated (withdrawn, mutually agreed solution)","16",July,"1997","6 July 2020"
DS92,"Quantitative Restrictions on Imports of Agricultural, Textile and Industrial Products",India,Canada,"Settled or terminated (withdrawn, mutually agreed solution)","16",July,"1997","6 July 2020"
DS91,"Quantitative Restrictions on Imports of Agricultural, Textile and Industrial Products",India,Australia,"Settled or terminated (withdrawn, mutually agreed solution)","16",July,"1997","6 July 2020"
DS90,"Quantitative Restrictions on Imports of Agricultural, Textile and Industrial Products",India,United States,Implementation notified by respondent,"15",July,"1997","6 July 2020"
DS89,Anti-Dumping Duties on Imports of Colour Television Receivers from Korea,United States,"Korea, Republic of","Settled or terminated (withdrawn, mutually agreed solution)","10",July,"1997","6 July 2020"
DS88,Measure Affecting Government Procurement,United States,European Communities,Authority for panel lapsed,"20",June,"1997","6 July 2020"
DS87,Taxes on Alcoholic Beverages,Chile,European Communities,Implementation notified by respondent,"4",June,"1997","6 July 2020"
DS86,Measures Affecting the Enforcement of Intellectual Property Rights,Sweden,United States,"Settled or terminated (withdrawn, mutually agreed solution)","28",May,"1997","6 July 2020"
DS85,Measures Affecting Textiles and Apparel Products,United States,European Communities,"Settled or terminated (withdrawn, mutually agreed solution)","22",May,"1997","6 July 2020"
DS84,Taxes on Alcoholic Beverages,"Korea, Republic of",United States,Implementation notified by respondent,"23",May,"1997","6 July 2020"
DS83,Measures Affecting the Enforcement of Intellectual Property Rights,Denmark,United States,"Settled or terminated (withdrawn, mutually agreed solution)","14",May,"1997","6 July 2020"
DS82,Measures Affecting the Grant of Copyright and Neighbouring Rights,Ireland,United States,"Settled or terminated (withdrawn, mutually agreed solution)","14",May,"1997","6 July 2020"
DS81,Measures Affecting Trade and Investment in the Automotive Sector,Brazil,European Communities,In consultations,"7",May,"1997","6 July 2020"
DS80,Measures Affecting Commercial Telephone Directory Services,Belgium,United States,In consultations,"2",May,"1997","6 July 2020"
DS79,Patent Protection for Pharmaceutical and Agricultural Chemical Products,India,European Communities,Implementation notified by respondent,"28",April,"1997","6 July 2020"
DS78,Safeguard Measure Against Imports of Broom Corn Brooms,United States,Colombia,In consultations,"28",April,"1997","6 July 2020"
DS77,"Measures Affecting Textiles, Clothing and Footwear",Argentina,European Communities,Authority for panel lapsed,"23",April,"1997","6 July 2020"
DS76,Measures Affecting Agricultural Products,Japan,United States,Mutually acceptable solution on implementation notified,"7",April,"1997","6 July 2020"
DS75,Taxes on Alcoholic Beverages,"Korea, Republic of",European Communities,Implementation notified by respondent,"2",April,"1997","6 July 2020"
DS74,Measures Affecting Pork and Poultry,Philippines,United States,"Settled or terminated (withdrawn, mutually agreed solution)","1",April,"1997","6 July 2020"
DS73,Procurement of a Navigation Satellite,Japan,European Communities,"Settled or terminated (withdrawn, mutually agreed solution)","26",March,"1997","6 July 2020"
DS72,Measures Affecting Butter Products,European Communities,New Zealand,"Settled or terminated (withdrawn, mutually agreed solution)","24",March,"1997","6 July 2020"
DS71,Measures Affecting the Export of Civilian Aircraft,Canada,Brazil,In consultations,"10",March,"1997","6 July 2020"
DS70,Measures Affecting the Export of Civilian Aircraft,Canada,Brazil,Compliance proceedings completed with finding(s) of non-compliance,"10",March,"1997","6 July 2020"
DS69,Measures Affecting Importation of Certain Poultry Products,European Communities,Brazil,"Report(s) adopted, with recommendation to bring measure(s) into conformity","24",February,"1997","6 July 2020"
DS68,Customs Classification of Certain Computer Equipment,Ireland,United States,"Report(s) adopted, no further action required","14",February,"1997","6 July 2020"
DS67,Customs Classification of Certain Computer Equipment,United Kingdom,United States,"Report(s) adopted, no further action required","14",February,"1997","6 July 2020"
DS66,Measures Affecting Imports of Pork,Japan,European Communities,In consultations,"25",January,"1997","6 July 2020"
DS65,Certain Measures Affecting Trade and Investment in the Automotive Sector,Brazil,United States,In consultations,"10",January,"1997","6 July 2020"
DS64,Certain Measures Affecting the Automobile Industry,Indonesia,Japan,Implementation notified by respondent,"29",November,"1996","6 July 2020"
DS63,Anti-Dumping Measures on Imports of Solid Urea from the Former German Democratic Republic,United States,European Communities,In consultations,"28",November,"1996","6 July 2020"
DS62,Customs Classification of Certain Computer Equipment,European Communities,United States,"Report(s) adopted, no further action required","8",November,"1996","6 July 2020"
DS61,Import Prohibition of Certain Shrimp and Shrimp Products,United States,Philippines,In consultations,"25",October,"1996","6 July 2020"
DS60,Anti-Dumping Investigation Regarding Portland Cement from Mexico,Guatemala,Mexico,"Report(s) adopted, no further action required","17",October,"1996","6 July 2020"
DS59,Certain Measures Affecting the Automobile Industry,Indonesia,United States,Implementation notified by respondent,"8",October,"1996","6 July 2020"
DS58,Import Prohibition of Certain Shrimp and Shrimp Products,United States,"['India', 'Malaysia', 'Pakistan', 'Thailand']",Compliance proceedings completed without finding of non-compliance,"8",October,"1996","6 July 2020"
DS57,"Textile, Clothing and Footwear Import Credit Scheme",Australia,United States,In consultations,"7",October,"1996","6 July 2020"
DS56,"Measures Affecting Imports of Footwear, Textiles, Apparel and other Items",Argentina,United States,Implementation notified by respondent,"4",October,"1996","6 July 2020"
DS55,Certain Measures Affecting the Automobile Industry,Indonesia,Japan,Implementation notified by respondent,"4",October,"1996","6 July 2020"
DS54,Certain Measures Affecting the Automobile Industry,Indonesia,European Communities,Implementation notified by respondent,"3",October,"1996","6 July 2020"
DS53,Customs Valuation of Imports,Mexico,European Communities,In consultations,"27",August,"1996","6 July 2020"
DS52,Certain Measures Affecting Trade and Investment in the Automotive Sector,Brazil,United States,In consultations,"9",August,"1996","6 July 2020"
DS51,Certain Automotive Investment Measures,Brazil,Japan,In consultations,"30",July,"1996","6 July 2020"
DS50,Patent Protection for Pharmaceutical and Agricultural Chemical Products,India,United States,Implementation notified by respondent,"2",July,"1996","6 July 2020"
DS49,Anti-Dumping Investigation Regarding Imports of Fresh or Chilled Tomatoes from Mexico,United States,Mexico,In consultations,"1",July,"1996","6 July 2020"
DS48,Measures Concerning Meat and Meat Products (Hormones),European Communities,Canada,Mutually acceptable solution on implementation notified,"28",July,"1996","6 July 2020"
DS47,Restrictions on Imports of Textile and Clothing Products,Turkey,Thailand,In consultations,"20",June,"1996","6 July 2020"
DS46,Export Financing Programme for Aircraft,Brazil,Canada,Compliance proceedings completed without finding of non-compliance,"19",June,"1996","6 July 2020"
DS45,Measures Affecting Distribution Services,Japan,United States,In consultations,"13",June,"1996","6 July 2020"
DS44,Measures Affecting Consumer Photographic Film and Paper,Japan,United States,"Report(s) adopted, no further action required","13",June,"1996","6 July 2020"
DS43,Taxation of Foreign Film Revenues,Turkey,United States,"Settled or terminated (withdrawn, mutually agreed solution)","12",June,"1996","6 July 2020"
DS42,Measures concerning Sound Recordings,Japan,European Communities,"Settled or terminated (withdrawn, mutually agreed solution)","28",May,"1996","6 July 2020"
DS41,Measures concerning Inspection of Agricultural Products,"Korea, Republic of",United States,In consultations,"24",May,"1996","6 July 2020"
DS40,"Laws, Regulations and Practices in the Telecommunications Procurement Sector","Korea, Republic of",European Communities,"Settled or terminated (withdrawn, mutually agreed solution)","5",May,"1996","6 July 2020"
DS39,Tariff Increases on Products from the European Communities,United States,European Communities,"Settled or terminated (withdrawn, mutually agreed solution)","18",April,"1996","6 July 2020"
DS38,The Cuban Liberty and Democratic Solidarity Act,United States,European Communities,Authority for panel lapsed,"3",May,"1996","6 July 2020"
DS37,Patent Protection under the Industrial Property Act,Portugal,United States,"Settled or terminated (withdrawn, mutually agreed solution)","30",April,"1996","6 July 2020"
DS36,Patent Protection for Pharmaceutical and Agricultural Chemical Products,Pakistan,United States,"Settled or terminated (withdrawn, mutually agreed solution)","30",April,"1996","6 July 2020"
DS35,Export Subsidies in respect of Agricultural Products,Hungary,"['Argentina', 'Australia', 'Canada', 'New Zealand', 'Thailand', 'United States']","Settled or terminated (withdrawn, mutually agreed solution)","27",March,"1996","6 July 2020"
DS34,Restrictions on Imports of Textile and Clothing Products,Turkey,India,Mutually acceptable solution on implementation notified,"21",March,"1996","6 July 2020"
DS33,Measures Affecting Imports of Woven Wool Shirts and Blouses from India,United States,India,Mutually acceptable solution on implementation notified,"14",March,"1996","6 July 2020"
DS32,Measures Affecting Imports of Womens and Girls Wool Coats,United States,India,"Settled or terminated (withdrawn, mutually agreed solution)","14",March,"1996","6 July 2020"
DS31,Certain Measures Concerning Periodicals,Canada,United States,Implementation notified by respondent,"11",March,"1996","6 July 2020"
DS30,Countervailing Duties on Imports of Desiccated Coconut and Coconut Milk Powder from Sri Lanka,Brazil,Sri Lanka,In consultations,"23",February,"1996","6 July 2020"
DS29,Restrictions on Imports of Textile and Clothing Products,Turkey,"Hong Kong, China",In consultations,"12",February,"1996","6 July 2020"
DS28,Measures Concerning Sound Recordings,Japan,United States,"Settled or terminated (withdrawn, mutually agreed solution)","9",February,"1996","6 July 2020"
DS27,"Regime for the Importation, Sale and Distribution of Bananas",European Communities,"['Ecuador', 'Guatemala', 'Honduras', 'Mexico', 'United States']","Settled or terminated (withdrawn, mutually agreed solution)","5",February,"1996","6 July 2020"
DS26,Measures Concerning Meat and Meat Products (Hormones),European Communities,United States,Mutually acceptable solution on implementation notified,"26",January,"1996","6 July 2020"
DS25,Implementation of the Uruguay Round Commitments Concerning Rice,European Communities,Uruguay,In consultations,"14",December,"1995","6 July 2020"
DS24,Restrictions on Imports of Cotton and Man-Made Fibre Underwear,United States,Costa Rica,Implementation notified by respondent,"22",December,"1995","6 July 2020"
DS23,Anti-Dumping Investigation in Respect of Imports of Certain Oil Country Tubular Goods (OCTG),"Venezuela, Bolivarian Republic of",Mexico,"Settled or terminated (withdrawn, mutually agreed solution)","5",December,"1995","6 July 2020"
DS22,Measures Affecting Desiccated Coconut,Brazil,Philippines,"Report(s) adopted, no further action required","30",November,"1995","6 July 2020"
DS21,Measures Affecting the Importation of Salmonids,Australia,United States,"Settled or terminated (withdrawn, mutually agreed solution)","20",November,"1995","6 July 2020"
DS20,Measures concerning Bottled Water,"Korea, Republic of",Canada,"Settled or terminated (withdrawn, mutually agreed solution)","8",November,"1995","6 July 2020"
DS19,Import Regime for Automobiles,Poland,India,"Settled or terminated (withdrawn, mutually agreed solution)","28",September,"1995","6 July 2020"
DS18,Measures Affecting Importation of Salmon,Australia,Canada,Mutually acceptable solution on implementation notified,"5",October,"1995","6 July 2020"
DS17,Duties on Imports of Rice,European Communities,Thailand,In consultations,"5",October,"1995","6 July 2020"
DS16,"Regime for the Importation, Sale and Distribution of Bananas",European Communities,"['Guatemala', 'Honduras', 'Mexico', 'United States']","Settled or terminated (withdrawn, mutually agreed solution)","28",September,"1995","6 July 2020"
DS15,Measures Affecting the Purchase of Telecommunications Equipment,Japan,European Communities,In consultations,"18",August,"1995","6 July 2020"
DS14,Trade Description of Scallops,European Communities,Chile,"Settled or terminated (withdrawn, mutually agreed solution)","24",July,"1995","6 July 2020"
DS13,Duties on Imports of Grains,European Communities,United States,"Settled or terminated (withdrawn, mutually agreed solution)","19",July,"1995","6 July 2020"
DS12,Trade Description of Scallops,European Communities,Peru,"Settled or terminated (withdrawn, mutually agreed solution)","18",July,"1995","6 July 2020"
DS11,Taxes on Alcoholic Beverages,Japan,United States,Mutually acceptable solution on implementation notified,"7",July,"1995","6 July 2020"
DS10,Taxes on Alcoholic Beverages,Japan,Canada,Mutually acceptable solution on implementation notified,"7",July,"1995","6 July 2020"
DS9,Duties on Imports of Cereals,European Communities,Canada,"Panel established, but not yet composed","30",June,"1995","6 July 2020"
DS8,Taxes on Alcoholic Beverages,Japan,European Communities,Mutually acceptable solution on implementation notified,"21",June,"1995","6 July 2020"
DS7,Trade Description of Scallops,European Communities,Canada,"Settled or terminated (withdrawn, mutually agreed solution)","19",May,"1995","6 July 2020"
DS6,Imposition of Import Duties on Automobiles from Japan under Sections 301 and 304 of the Trade act of 1974,United States,Japan,"Settled or terminated (withdrawn, mutually agreed solution)","17",May,"1995","6 July 2020"
DS5,Measures Concerning the Shelf-Life of Products,"Korea, Republic of",United States,"Settled or terminated (withdrawn, mutually agreed solution)","3",May,"1995","6 July 2020"
DS4,Standards for Reformulated and Conventional Gasoline,United States,Brazil,Implementation notified by respondent,"10",April,"1995","6 July 2020"
DS3,Measures Concerning the Testing and Inspection of Agricultural Products,"Korea, Republic of",United States,In consultations,"4",April,"1995","6 July 2020"
DS2,Standards for Reformulated and Conventional Gasoline,United States,"Venezuela, Bolivarian Republic of",Implementation notified by respondent,"24",January,"1995","6 July 2020"
DS1,Prohibition of Imports of Polyethylene and Polypropylene,Malaysia,Singapore,"Settled or terminated (withdrawn, mutually agreed solution)","10",January,"1995","6 July 2020"
