"ds_num","title","resp","comp","status","consultations_requested_date","consultations_requested_month","consultations_requested_year","date_added"
DS287,Quarantine Regime for Imports,Australia,European Communities,"Settled or terminated (withdrawn, mutually agreed solution)","3",April,"2003","6 July 2020"
DS286,Customs Classification of Frozen Boneless Chicken Cuts,European Communities,Thailand,Implementation notified by respondent,"25",March,"2003","6 July 2020"
DS285,Measures Affecting the Cross-Border Supply of Gambling and Betting Services,United States,Antigua and Barbuda,Authorization to retaliate granted,"13",March,"2003","6 July 2020"
DS284,Certain Measures Preventing the Importation of Black Beans from Nicaragua,Mexico,Nicaragua,"Settled or terminated (withdrawn, mutually agreed solution)","17",March,"2003","6 July 2020"
DS283,Export Subsidies on Sugar,European Communities,Thailand,Implementation notified by respondent,"14",March,"2003","6 July 2020"
DS282,Anti-Dumping Measures on Oil Country Tubular Goods (OCTG) from Mexico,United States,Mexico,Authority for panel lapsed,"18",February,"2003","6 July 2020"
DS281,Anti-Dumping Measures on Cement from Mexico,United States,Mexico,"Settled or terminated (withdrawn, mutually agreed solution)","31",January,"2003","6 July 2020"
DS280,Countervailing Duties on Steel Plate from Mexico,United States,Mexico,"Panel established, but not yet composed","21",January,"2003","6 July 2020"
DS279,Import Restrictions Maintained Under the Export and Import Policy 2002-2007,India,European Communities,In consultations,"23",December,"2002","6 July 2020"
DS278,Definitive Safeguard Measure on Imports of Fructose,Chile,Argentina,In consultations,"20",December,"2002","6 July 2020"
DS277,Investigation of the International Trade Commission in Softwood Lumber from Canada,United States,Canada,Mutually acceptable solution on implementation notified,"20",December,"2002","6 July 2020"
DS276,Measures Relating to Exports of Wheat and Treatment of Imported Grain,Canada,United States,Implementation notified by respondent,"17",December,"2002","6 July 2020"
DS275,Import Licensing Measures on Certain Agricultural Products,"Venezuela, Bolivarian Republic of",United States,In consultations,"7",November,"2002","6 July 2020"
DS274,Definitive Safeguard Measures on Imports of Certain Steel Products,United States,Chinese Taipei,In consultations,"1",November,"2002","6 July 2020"
DS273,Measures Affecting Trade in Commercial Vessels,"Korea, Republic of",European Communities,Implementation notified by respondent,"21",October,"2002","6 July 2020"
DS272,Provisional Anti-Dumping Duties on Vegetable Oils from Argentina,Peru,Argentina,In consultations,"21",October,"2002","6 July 2020"
DS271,Certain Measures Affecting the Importation of Fresh Pineapple,Australia,Philippines,In consultations,"18",October,"2002","6 July 2020"
DS270,Certain Measures Affecting the Importation of Fresh Fruit and Vegetables,Australia,Philippines,"Panel established, but not yet composed","18",October,"2002","6 July 2020"
DS269,Customs Classification of Frozen Boneless Chicken Cuts,European Communities,Brazil,Implementation notified by respondent,"11",October,"2002","6 July 2020"
DS268,Sunset Reviews of Anti-Dumping Measures on Oil Country Tubular Goods from Argentina,United States,Argentina,Authorization to retaliate requested (including 22.6 arbitration),"7",October,"2002","6 July 2020"
DS267,Subsidies on Upland Cotton,United States,Brazil,Mutually acceptable solution on implementation notified,"27",September,"2002","6 July 2020"
DS266,Export Subsidies on Sugar,European Communities,Brazil,"Report(s) adopted, with recommendation to bring measure(s) into conformity","27",September,"2002","6 July 2020"
DS265,Export Subsidies on Sugar,European Communities,Australia,"Report(s) adopted, with recommendation to bring measure(s) into conformity","27",September,"2002","6 July 2020"
DS264,Final Dumping Determination on Softwood Lumber from Canada,United States,Canada,Mutually acceptable solution on implementation notified,"13",September,"2002","6 July 2020"
DS263,Measures Affecting Imports of Wine,European Communities,Argentina,In consultations,"4",September,"2002","6 July 2020"
DS262,Sunset Reviews of Anti-Dumping and Countervailing Duties on Certain Steel Products from France and Germany,United States,European Communities,In consultations,"25",July,"2002","6 July 2020"
DS261,Tax Treatment on Certain Products,Uruguay,Chile,"Settled or terminated (withdrawn, mutually agreed solution)","18",June,"2002","6 July 2020"
DS260,Provisional Safeguard Measures on Imports of Certain Steel Products,European Communities,United States,"Panel established, but not yet composed","30",May,"2002","6 July 2020"
DS259,Definitive Safeguard Measures on Imports of Certain Steel Products,United States,Brazil,"Report(s) adopted, no further action required","21",May,"2002","6 July 2020"
DS258,Definitive Safeguard Measures on Imports of Certain Steel Products,United States,New Zealand,"Report(s) adopted, no further action required","14",May,"2002","6 July 2020"
DS127,Certain Income Tax Measures Constituting Subsidies,Belgium,United States,In consultations,"5",May,"1998","6 July 2020"
DS257,Final Countervailing Duty Determination with respect to certain Softwood Lumber from Canada,United States,Canada,Mutually acceptable solution on implementation notified,"3",May,"2002","6 July 2020"
DS256,Import Ban on Pet Food from Hungary,Turkey,Hungary,In consultations,"3",May,"2002","6 July 2020"
DS255,Tax Treatment on Certain Imported Products,Peru,Chile,"Settled or terminated (withdrawn, mutually agreed solution)","22",April,"2002","6 July 2020"
DS254,Definitive Safeguard Measures on Imports of Certain Steel Products,United States,Norway,"Report(s) adopted, no further action required","4",April,"2002","6 July 2020"
DS253,Definitive Safeguard Measures on Imports of Certain Steel Products,United States,Switzerland,"Report(s) adopted, no further action required","3",April,"2002","6 July 2020"
DS252,Definitive Safeguard Measures on Imports of Certain Steel Products,United States,China,"Report(s) adopted, no further action required","26",March,"2002","6 July 2020"
DS251,Definitive Safeguard Measures on Imports of Certain Steel Products,United States,"Korea, Republic of","Report(s) adopted, no further action required","20",March,"2002","6 July 2020"
DS250,Equalizing Excise Tax Imposed by Florida on Processed Orange and Grapefruit Products,United States,Brazil,"Settled or terminated (withdrawn, mutually agreed solution)","20",March,"2002","6 July 2020"
DS249,Definitive Safeguard Measures on Imports of Certain Steel Products,United States,Japan,"Report(s) adopted, no further action required","20",March,"2002","6 July 2020"
DS248,Definitive Safeguard Measures on Imports of Certain Steel Products,United States,European Communities,"Report(s) adopted, no further action required","7",March,"2002","6 July 2020"
DS247,Provisional Anti-Dumping Measure on Imports of Certain Softwood Lumber from Canada,United States,Canada,"Settled or terminated (withdrawn, mutually agreed solution)","6",March,"2002","6 July 2020"
DS246,Conditions for the Granting of Tariff Preferences to Developing Countries,European Communities,India,Implementation notified by respondent,"5",March,"2002","6 July 2020"
DS245,Measures Affecting the Importation of Apples,Japan,United States,Mutually acceptable solution on implementation notified,"1",March,"2002","6 July 2020"
DS244,Sunset Review of Anti-Dumping Duties on Corrosion-Resistant Carbon Steel Flat Products from Japan,United States,Japan,"Report(s) adopted, no further action required","30",January,"2002","6 July 2020"
DS243,Rules of Origin for Textiles and Apparel Products,United States,India,"Report(s) adopted, no further action required","11",January,"2002","6 July 2020"
DS242,Generalized System of Preferences,European Communities,Thailand,In consultations,"7",December,"2001","6 July 2020"
DS241,Definitive Anti-Dumping Duties on Poultry from Brazil,Argentina,Brazil,"Report(s) adopted, with recommendation to bring measure(s) into conformity","7",November,"2001","6 July 2020"
DS240,Import Prohibition on Wheat and Wheat Flour,Romania,Hungary,"Settled or terminated (withdrawn, mutually agreed solution)","18",October,"2001","6 July 2020"
DS239,Anti-Dumping Duties on Silicon Metal from Brazil,United States,Brazil,In consultations,"18",September,"2001","6 July 2020"
DS238,Definitive Safeguard Measure on Imports of Preserved Peaches,Argentina,Chile,Implementation notified by respondent,"14",September,"2001","6 July 2020"
DS237,Certain Import Procedures for Fresh Fruit,Turkey,Ecuador,"Settled or terminated (withdrawn, mutually agreed solution)","31",August,"2001","6 July 2020"
DS236,Preliminary Determinations with Respect to Certain Softwood Lumber from Canada,United States,Canada,Mutually acceptable solution on implementation notified,"21",August,"2001","6 July 2020"
DS235,Safeguard Measure on Imports of Sugar,Slovak Republic,Poland,"Settled or terminated (withdrawn, mutually agreed solution)","11",July,"2001","6 July 2020"
DS234,Continued Dumping and Subsidy Offset Act of 2000,United States,"['Canada', 'Mexico']","Authorization to retaliate granted, Authorization to retaliate granted","21",May,"2001","6 July 2020"
DS233,Measures Affecting the Import of Pharmaceutical Products,Argentina,India,In consultations,"25",May,"2001","6 July 2020"
DS232,Measures Affecting the Import of Matches,Mexico,Chile,"Settled or terminated (withdrawn, mutually agreed solution)","17",May,"2001","6 July 2020"
DS231,Trade Description of Sardines,European Communities,Peru,Mutually acceptable solution on implementation notified,"20",March,"2001","6 July 2020"
DS230,Safeguard Measures and Modification of Schedules Regarding Sugar,Chile,Colombia,In consultations,"17",April,"2001","6 July 2020"
DS229,Anti-Dumping Duties on Jute Bags from India,Brazil,India,In consultations,"9",April,"2001","6 July 2020"
DS228,Safeguard Measures on Sugar,Chile,Colombia,"Settled or terminated (withdrawn, mutually agreed solution)","15",March,"2001","6 July 2020"
DS227,Taxes on Cigarettes,Peru,Chile,"Settled or terminated (withdrawn, mutually agreed solution)","1",March,"2001","6 July 2020"
DS226,Provisional Safeguard Measure on Mixtures of Edible Oils,Chile,Argentina,In consultations,"19",February,"2001","6 July 2020"
DS225,Anti-Dumping Duties on Seamless Pipe from Italy,United States,European Communities,In consultations,"5",February,"2001","6 July 2020"
DS224,US Patents Code,United States,Brazil,In consultations,"31",January,"2001","6 July 2020"
DS223,Tariff-Rate Quota on Corn Gluten Feed from the United States,European Communities,United States,In consultations,"25",January,"2001","6 July 2020"
DS222,Export Credits and Loan Guarantees for Regional Aircraft,Canada,Brazil,Authorization to retaliate granted,"22",January,"2001","6 July 2020"
DS221,Section 129(c)(1) of the Uruguay Round Agreements Act,United States,Canada,"Report(s) adopted, no further action required","17",January,"2001","6 July 2020"
DS220,Price Band System and Safeguard Measures Relating to Certain Agricultural Products,Chile,Guatemala,In consultations,"5",January,"2001","6 July 2020"
DS219,Anti-Dumping Duties on Malleable Cast Iron Tube or Pipe Fittings from Brazil,European Communities,Brazil,Implementation notified by respondent,"21",December,"2000","6 July 2020"
DS218,Countervailing Duties on Certain Carbon Steel Products from Brazil,United States,Brazil,In consultations,"21",December,"2000","6 July 2020"
DS217,Continued Dumping and Subsidy Offset Act of 2000,United States,"['Australia', 'Brazil', 'Chile', 'European Communities', 'India', 'Indonesia', 'Japan', 'Korea, Republic of', 'Thailand']",Authorization to retaliate granted,"21",December,"2000","6 July 2020"
DS216,Provisional Anti-Dumping Measure on Electric Transformers,Mexico,Brazil,In consultations,"20",December,"2000","6 July 2020"
DS215,Anti-Dumping Measures Regarding Polypropylene Resins from Korea,Philippines,"Korea, Republic of",In consultations,"15",December,"2000","6 July 2020"
DS172,Measures Relating to the Development of a Flight Management System,European Communities,United States,In consultations,"21",May,"1999","6 July 2020"
DS214,Definitive Safeguard Measures on Imports of Steel Wire Rod and Circular Welded Quality Line Pipe,United States,European Communities,"Panel established, but not yet composed","1",December,"2000","6 July 2020"
DS213,Countervailing Duties on Certain Corrosion-Resistant Carbon Steel Flat Products from Germany,United States,European Communities,Implementation notified by respondent,"10",November,"2000","6 July 2020"
DS212,Countervailing Measures Concerning Certain Products from the European Communities,United States,European Communities,Implementation notified by respondent,"10",November,"2000","6 July 2020"
DS211,Definitive Anti-Dumping Measures on Steel Rebar from Turkey,Egypt,Turkey,Implementation notified by respondent,"6",November,"2000","6 July 2020"
DS210,Administration of Measures Establishing Customs Duties for Rice,Belgium,United States,"Settled or terminated (withdrawn, mutually agreed solution)","12",October,"2000","6 July 2020"
DS209,Measures Affecting Soluble Coffee,European Communities,Brazil,In consultations,"12",October,"2000","6 July 2020"
DS208,Anti-Dumping Duty on Steel and Iron Pipe Fittings,Turkey,Brazil,In consultations,"9",October,"2000","6 July 2020"
DS207,Price Band System and Safeguard Measures Relating to Certain Agricultural Products,Chile,Argentina,Compliance proceedings completed with finding(s) of non-compliance,"5",October,"2000","6 July 2020"
DS206,Anti-Dumping and Countervailing Measures on Steel Plate from India,United States,India,Implementation notified by respondent,"4",October,"2000","6 July 2020"
DS205,Import Prohibition on Canned Tuna with Soybean Oil,Egypt,Thailand,In consultations,"22",September,"2000","6 July 2020"
DS204,Measures Affecting Telecommunications Services,Mexico,United States,Implementation notified by respondent,"17",August,"2000","6 July 2020"
DS203,Measures Affecting Trade in Live Swine,Mexico,United States,In consultations,"10",July,"2000","6 July 2020"
DS202,Definitive Safeguard Measures on Imports of Circular Welded Carbon Quality Line Pipe from Korea,United States,"Korea, Republic of",Implementation notified by respondent,"13",June,"2000","6 July 2020"
DS201,Measures Affecting Imports from Honduras and Colombia,Nicaragua,Honduras,In consultations,"6",June,"2000","6 July 2020"
DS200,Section 306 of the Trade Act 1974 and Amendments thereto,United States,European Communities,In consultations,"5",June,"2000","6 July 2020"
DS199,Measures Affecting Patent Protection,Brazil,United States,"Settled or terminated (withdrawn, mutually agreed solution)","30",May,"2000","6 July 2020"
DS198,Measures on Minimum Import Prices,Romania,United States,"Settled or terminated (withdrawn, mutually agreed solution)","30",May,"2000","6 July 2020"
DS197,Measures on Minimum Import Prices,Brazil,United States,In consultations,"30",May,"2000","6 July 2020"
DS196,Certain Measures on the Protection of Patents and Test Data,Argentina,United States,"Settled or terminated (withdrawn, mutually agreed solution)","30",May,"2000","6 July 2020"
DS195,Measures Affecting Trade and Investment in the Motor Vehicle Sector,Philippines,United States,"Panel established, but not yet composed","23",May,"2000","6 July 2020"
DS194,Measures Treating Export Restraints as Subsidies,United States,Canada,"Report(s) adopted, no further action required","19",May,"2000","6 July 2020"
DS193,Measures affecting the Transit and Importing of Swordfish,Chile,European Communities,"Settled or terminated (withdrawn, mutually agreed solution)","19",April,"2000","6 July 2020"
DS192,Transitional Safeguard Measure on Combed Cotton Yarn from Pakistan,United States,Pakistan,Implementation notified by respondent,"3",April,"2000","6 July 2020"
DS191,Definitive Anti-Dumping Measure on Cement from Mexico,Ecuador,Mexico,In consultations,"15",March,"2000","6 July 2020"
DS190,Transitional Safeguard Measures on Certain Imports of Woven Fabric Products of Cotton and Cotton Mixtures Originating in Brazil,Argentina,Brazil,"Settled or terminated (withdrawn, mutually agreed solution)","11",February,"2000","6 July 2020"
DS189,Definitive Anti-Dumping Measures on Carton-Board Imports from Germany and Definitive Anti-Dumping Measures on Imports of Ceramic Tiles from Italy,Argentina,European Communities,Implementation notified by respondent,"26",January,"2000","6 July 2020"
DS188,Measures Affecting Imports from Honduras and Colombia,Nicaragua,Colombia,"Panel established, but not yet composed","17",January,"2000","6 July 2020"
DS187,Provisional Anti-Dumping Measure on Macaroni and Spaghetti from Costa Rica,Trinidad and Tobago,Costa Rica,In consultations,"17",January,"2000","6 July 2020"
DS186,Section 337 of the Tariff Act of 1930 and Amendments thereto,United States,European Communities,In consultations,"12",January,"2000","6 July 2020"
DS185,Anti-Dumping Measures on Pasta from Costa Rica,Trinidad and Tobago,Costa Rica,In consultations,"18",November,"1999","6 July 2020"
DS184,Anti-Dumping Measures on Certain Hot-Rolled Steel Products from Japan,United States,Japan,"Report(s) adopted, with recommendation to bring measure(s) into conformity","18",November,"1999","6 July 2020"
DS183,Measures on Import Licensing and Minimum Import Prices,Brazil,European Communities,In consultations,"14",October,"1999","6 July 2020"
DS182,Provisional Anti-Dumping Measure on Cement from Mexico,Ecuador,Mexico,In consultations,"5",October,"1999","6 July 2020"
DS181,Safeguard Measure of Imports of Plain Polyester Filaments from Thailand,Colombia,Thailand,"Settled or terminated (withdrawn, mutually agreed solution)","7",September,"1999","6 July 2020"
DS180,Reclassification of Certain Sugar Syrups,United States,Canada,In consultations,"6",September,"1999","6 July 2020"
DS179,Anti-Dumping measures on Stainless Steel Plate in Coils and Stainless Steel Sheet and Strip from Korea,United States,"Korea, Republic of",Implementation notified by respondent,"30",July,"1999","6 July 2020"
DS178,"Safeguard Measure on Imports of Fresh, Chilled or Frozen Lamb from Australia",United States,Australia,Implementation notified by respondent,"23",July,"1999","6 July 2020"
DS177,"Safeguard Measure on Imports of Fresh, Chilled or Frozen Lamb from New Zealand",United States,New Zealand,Implementation notified by respondent,"16",July,"1999","6 July 2020"
DS176,Section 211 Omnibus Appropriations Act of 1998,United States,European Communities,"Report(s) adopted, with recommendation to bring measure(s) into conformity","8",July,"1999","6 July 2020"
DS175,Measures Affecting Trade and Investment in the Motor Vehicle Sector,India,United States,Implementation notified by respondent,"2",June,"1999","6 July 2020"
DS174,Protection of Trademarks and Geographical Indications for Agricultural Products and Foodstuffs,European Communities,United States,Implementation notified by respondent,"1",June,"1999","6 July 2020"
DS173,Measures Relating to the Development of a Flight Management System,France,United States,In consultations,"21",May,"1999","6 July 2020"
DS171,Patent Protection for Pharmaceuticals and Test Data Protection for Agricultural Chemicals,Argentina,United States,"Settled or terminated (withdrawn, mutually agreed solution)","6",May,"1999","6 July 2020"
DS170,Term of Patent Protection,Canada,United States,Implementation notified by respondent,"6",May,"1999","6 July 2020"
DS169,"Measures Affecting Imports of Fresh, Chilled and Frozen Beef","Korea, Republic of",Australia,Implementation notified by respondent,"13",April,"1999","6 July 2020"
DS168,Anti-Dumping Duties on Certain Pharmaceutical Products from India,South Africa,India,In consultations,"1",April,"1999","6 July 2020"
DS167,Countervailing Duty Investigation with respect to Live Cattle from Canada,United States,Canada,In consultations,"19",March,"1999","6 July 2020"
DS166,Definitive Safeguard Measures on Imports of Wheat Gluten from the European Communities,United States,European Communities,"Report(s) adopted, with recommendation to bring measure(s) into conformity","17",March,"1999","6 July 2020"
DS165,Import Measures on Certain Products from the European Communities,United States,European Communities,"Report(s) adopted, no further action required","4",March,"1999","6 July 2020"
DS164,Measures Affecting Imports of Footwear,Argentina,United States,"Panel established, but not yet composed","1",March,"1999","6 July 2020"
DS163,Measures Affecting Government Procurement,"Korea, Republic of",United States,"Report(s) adopted, no further action required","16",February,"1999","6 July 2020"
DS162,Anti-Dumping Act of 1916,United States,Japan,Implementation notified by respondent,"10",February,"1999","6 July 2020"
DS161,"Measures Affecting Imports of Fresh, Chilled and Frozen Beef","Korea, Republic of",United States,Implementation notified by respondent,"1",February,"1999","6 July 2020"
DS160,Section 110(5) of US Copyright Act,United States,European Communities,Authorization to retaliate requested (including 22.6 arbitration),"26",January,"1999","6 July 2020"
DS159,Safeguard Measure on Imports of Steel Products from the Czech Republic,Hungary,Czech Republic,In consultations,"21",January,"1999","6 July 2020"
DS158,"Regime for the Importation, Sale and Distribution of Bananas",European Communities,"['Guatemala', 'Honduras', 'Mexico', 'Panama', 'United States']","Settled or terminated (withdrawn, mutually agreed solution)","20",January,"1999","6 July 2020"
DS157,Definitive Anti-Dumping Measures on Imports of Drill Bits from Italy,Argentina,European Communities,In consultations,"14",January,"1999","6 July 2020"
DS156,Definitive Anti-Dumping Measure on Grey Portland Cement from Mexico,Guatemala,Mexico,Implementation notified by respondent,"5",January,"1999","6 July 2020"
DS155,Measures Affecting the Export of Bovine Hides and the Import of Finished Leather,Argentina,European Communities,"Report(s) adopted, with recommendation to bring measure(s) into conformity","23",December,"1998","6 July 2020"
DS154,Measures Affecting Differential and Favourable Treatment of Coffee,European Communities,Brazil,In consultations,"7",December,"1998","6 July 2020"
DS153,Patent Protection for Pharmaceutical and Agricultural Chemical Products,European Communities,Canada,In consultations,"2",December,"1998","6 July 2020"
DS152,Sections 301-310 of the Trade Act 1974,United States,European Communities,"Report(s) adopted, no further action required","25",November,"1998","6 July 2020"
DS151,Measures Affecting Textiles and Apparel Products (II),United States,European Communities,"Settled or terminated (withdrawn, mutually agreed solution)","19",November,"1998","6 July 2020"
DS150,Measures Affecting Customs Duties,India,European Communities,In consultations,"31",October,"1998","6 July 2020"
DS149,Import Restrictions,India,European Communities,In consultations,"28",October,"1998","6 July 2020"
DS148,Measure Affecting Import Duty on Wheat from Hungary,Czech Republic,Hungary,In consultations,"12",October,"1998","6 July 2020"
DS147,Tariff Quotas and Subsidies Affecting Leather,Japan,European Communities,In consultations,"8",October,"1998","6 July 2020"
DS146,Measures Affecting the Automotive Sector,India,European Communities,Implementation notified by respondent,"6",October,"1998","6 July 2020"
DS145,Countervailing Duties on Imports of Wheat Gluten from the European Communities,Argentina,European Communities,In consultations,"23",September,"1998","6 July 2020"
DS144,"Certain Measures Affecting the Import of Cattle, Swine and Grain from Canada",United States,Canada,In consultations,"25",September,"1998","6 July 2020"
DS143,Measure Affecting Import Duty on Wheat from Hungary,Slovak Republic,Hungary,In consultations,"19",September,"1998","6 July 2020"
DS142,Certain Measures Affecting the Automotive Industry,Canada,European Communities,Implementation notified by respondent,"17",August,"1998","6 July 2020"
DS141,Anti-Dumping Duties on Imports of Cotton-type Bed Linen from India,European Communities,India,Compliance proceedings completed with finding(s) of non-compliance,"3",August,"1998","6 July 2020"
DS140,Anti-Dumping Investigations Regarding Unbleached Cotton Fabrics from India,European Communities,India,In consultations,"3",August,"1998","6 July 2020"
DS139,Certain Measures Affecting the Automotive Industry,Canada,Japan,Implementation notified by respondent,"3",July,"1998","6 July 2020"
DS138,Imposition of Countervailing Duties on Certain Hot-Rolled Lead and Bismuth Carbon Steel Products Originating in the United Kingdom,United States,European Communities,Implementation notified by respondent,"12",June,"1998","6 July 2020"
DS137,Measures Affecting Imports of Wood of Conifers from Canada,European Communities,Canada,In consultations,"17",June,"1998","6 July 2020"
DS136,Anti-Dumping Act of 1916,United States,European Communities,Implementation notified by respondent,"4",June,"1998","6 July 2020"
DS135,Measures Affecting Asbestos and Products Containing Asbestos,European Communities,Canada,"Report(s) adopted, no further action required","28",May,"1998","6 July 2020"
DS134,Restrictions on Certain Import Duties on Rice,European Communities,India,In consultations,"27",May,"1998","6 July 2020"
DS133,Measures Concerning the Importation of Dairy Products and the Transit of Cattle,Slovak Republic,Switzerland,In consultations,"7",May,"1998","6 July 2020"
DS132,Anti-Dumping Investigation of High-Fructose Corn Syrup (HFCS) from the United States,Mexico,United States,Compliance proceedings completed with finding(s) of non-compliance,"8",May,"1998","6 July 2020"
DS131,Certain Income Tax Measures Constituting Subsidies,France,United States,In consultations,"5",May,"1998","6 July 2020"
